{
  "$schema": "../schema/external-bridge-contract.schema.json",
  "schema": "jqstar-external-bridge-contract/1",
  "ownerTicket": "0016",
  "contractVersion": 1,
  "publicBoundary": {
    "allowedImports": ["jquery-star/core", "jquery-star/testing"],
    "forbiddenImports": [
      "src/*",
      "kernelForDocument",
      "application collections",
      "patch coordinator",
      "MutationObserver lifecycle inference"
    ],
    "renderAdapterSha256": "780f853e2728ec9a2e08a9aa0e08be44396f6fceb919c3639784498b916e0b53"
  },
  "stateMachine": {
    "phases": ["idle", "prepared", "removing", "externally-mutated", "enhancing", "committed"],
    "terminal": ["canceled", "failed"],
    "requiredOrder": [
      "intent",
      "begin",
      "beforeRemove",
      "hostMutation",
      "commit",
      "whenEnhanced",
      "hostComplete"
    ],
    "preMutationCancellation": "no-render-transaction"
  },
  "overlapPolicy": {
    "disjoint": "parallel-distinct-operation-ids",
    "same": "reject-before-begin",
    "ancestor": "reject-before-begin",
    "descendant": "reject-before-begin",
    "nestedCleanup": "deduplicate-deepest-first"
  },
  "observation": {
    "schema": "jqstar-external-render-observation/1",
    "allowedFields": [
      "sequence",
      "bridgeOperationId",
      "renderOperationId",
      "host",
      "version",
      "flowId",
      "boundaryCategory",
      "phase",
      "outcome",
      "removalCount"
    ],
    "redactedFields": [
      "url",
      "query",
      "formValues",
      "headers",
      "requestBody",
      "responseBody",
      "html",
      "error",
      "dom",
      "state",
      "signals",
      "historyValue"
    ],
    "terminalOutcomes": [
      "completed",
      "canceled-before-mutation",
      "failed-before-mutation",
      "failed-after-removal",
      "failed-after-mutation"
    ]
  },
  "libraries": {
    "turbo": {
      "package": "@hotwired/turbo",
      "stableChannel": "8.0.x",
      "approvedRange": ">=8.0.21 <8.1.0",
      "browserProjects": ["desktop-chromium", "desktop-firefox", "desktop-webkit"],
      "fixtureTest": "e2e/interoperability-baseline.spec.ts",
      "versionDetection": {
        "source": "explicit caller-supplied package version because Turbo exports no documented runtime version field",
        "required": true
      },
      "unsupportedVersionPolicy": {
        "missing": "reject-before-listeners",
        "unknown": "reject-before-listeners",
        "prerelease": "reject-before-listeners",
        "outOfRange": "reject-before-listeners"
      },
      "dependencyPolicy": "development-fixture-alias-and-optional-peer-only",
      "boundaries": [
        {
          "role": "oldest",
          "version": "8.0.21",
          "alias": "turbo-8-0-21",
          "tarball": "https://registry.npmjs.org/@hotwired/turbo/-/turbo-8.0.21.tgz",
          "integrity": "sha512-fJTv3JnzFHeDxBb23esZSOhT4r142xf5o3lKMFMvzPC6AllkqbBKk5Yb31UZhtIsKQCwmO/pUQrtTUlYl5CHAQ==",
          "sha1": "a3e80c01d70048200f64bbe3582b84f9bfac034e"
        },
        {
          "role": "newest",
          "version": "8.0.23",
          "alias": "turbo-8-0-23",
          "tarball": "https://registry.npmjs.org/@hotwired/turbo/-/turbo-8.0.23.tgz",
          "integrity": "sha512-GZ7cijxEZ6Ig71u7rD6LHaRv/wcE/hNsc+nEfiWOkLNqUgLOwo5MNGWOy5ZV9ZUDSiQx1no7YxjTNnT4O6//cQ==",
          "sha1": "a6eebc9ab4a5faadae265a4cbec8cfcb5731e77c"
        }
      ],
      "officialSources": [
        {
          "id": "turbo.security",
          "url": "https://github.com/advisories/GHSA-qppm-g56g-fpvp",
          "contract": "Turbo versions through 8.0.20 are affected; 8.0.21 is the first patched release."
        },
        {
          "id": "turbo.events",
          "url": "https://turbo.hotwired.dev/reference/events",
          "contract": "Public Drive and Frame intent, render, completion, cache, request, and error events."
        },
        {
          "id": "turbo.drive",
          "url": "https://turbo.hotwired.dev/handbook/drive",
          "contract": "Pausable document rendering, visits, forms, caching, and host-owned navigation behavior."
        },
        {
          "id": "turbo.frames",
          "url": "https://turbo.hotwired.dev/handbook/frames",
          "contract": "Pausable Frame rendering and frame-scoped navigation behavior."
        },
        {
          "id": "turbo.attributes",
          "url": "https://turbo.hotwired.dev/reference/attributes",
          "contract": "data-turbo-permanent requires a unique id and remains a Turbo-owned concept."
        }
      ],
      "preservation": {
        "marker": "data-turbo-permanent",
        "key": "unique-id-with-incoming-match",
        "checks": [
          "old-connected",
          "old-inside-boundary",
          "old-marker",
          "unique-old-id",
          "unique-incoming-id",
          "same-document",
          "retained-after-mutation"
        ],
        "mismatch": "destroy-and-record-diagnostic"
      },
      "mappings": [
        {
          "id": "turbo.document.visit",
          "flow": "Drive advance, replace, or redirect visit",
          "mutation": true,
          "intentEvents": ["turbo:before-visit", "turbo:visit"],
          "mutationEvent": "turbo:before-render detail.render wrapper",
          "removalBoundary": "currentBody child removal boundaries",
          "postMutationEvent": "turbo:render",
          "barrier": "jquery-star.whenEnhanced",
          "terminalEvent": "turbo:load",
          "cancelEvents": ["canceled turbo:before-visit", "canceled turbo:before-render"],
          "errorEvents": ["turbo:fetch-request-error", "turbo:reload"],
          "requiredOrder": [
            "before-render",
            "beforeRemove",
            "detail.render",
            "commit",
            "render",
            "load"
          ]
        },
        {
          "id": "turbo.form.visit",
          "flow": "GET or non-GET form submission followed by a Drive visit",
          "mutation": true,
          "intentEvents": ["turbo:submit-start", "turbo:submit-end", "turbo:before-visit"],
          "mutationEvent": "turbo:before-render detail.render wrapper for the follow-up visit",
          "removalBoundary": "currentBody child removal boundaries",
          "postMutationEvent": "turbo:render",
          "barrier": "jquery-star.whenEnhanced",
          "terminalEvent": "turbo:load",
          "cancelEvents": ["canceled turbo:submit-start", "canceled turbo:before-render"],
          "errorEvents": ["turbo:fetch-request-error", "turbo:submit-end success=false"],
          "requiredOrder": [
            "submit-start",
            "submit-end and before-visit in browser-dependent relative order",
            "both submit-end and before-visit precede before-render",
            "before-render",
            "beforeRemove",
            "detail.render",
            "commit",
            "render",
            "load"
          ]
        },
        {
          "id": "turbo.document.restore",
          "flow": "Drive history restoration including cached preview and fresh render",
          "mutation": true,
          "intentEvents": ["turbo:visit action=restore", "turbo:before-cache"],
          "mutationEvent": "each turbo:before-render detail.render wrapper",
          "removalBoundary": "currentBody child removal boundaries",
          "postMutationEvent": "each turbo:render",
          "barrier": "jquery-star.whenEnhanced",
          "terminalEvent": "turbo:load",
          "cancelEvents": [],
          "errorEvents": ["turbo:reload"],
          "requiredOrder": ["visit", "before-render", "render", "load"]
        },
        {
          "id": "turbo.frame.replace",
          "flow": "Turbo Frame replacement",
          "mutation": true,
          "intentEvents": ["turbo:before-fetch-request"],
          "mutationEvent": "turbo:before-frame-render detail.render wrapper",
          "removalBoundary": "currentFrame child removal boundaries",
          "postMutationEvent": "turbo:frame-render",
          "barrier": "jquery-star.whenEnhanced",
          "terminalEvent": "turbo:frame-load",
          "cancelEvents": ["canceled turbo:before-frame-render"],
          "errorEvents": ["turbo:frame-missing", "turbo:fetch-request-error"],
          "requiredOrder": [
            "before-frame-render",
            "beforeRemove",
            "detail.render",
            "commit",
            "frame-render",
            "frame-load"
          ]
        },
        {
          "id": "turbo.cache.snapshot",
          "flow": "Drive cache snapshot",
          "mutation": false,
          "intentEvents": ["turbo:before-cache"],
          "mutationEvent": null,
          "removalBoundary": null,
          "postMutationEvent": null,
          "barrier": "none",
          "terminalEvent": "turbo:before-cache",
          "cancelEvents": [],
          "errorEvents": [],
          "requiredOrder": ["before-cache"]
        },
        {
          "id": "turbo.document.no-render",
          "flow": "204, empty, or native reload response without Turbo render",
          "mutation": false,
          "intentEvents": ["turbo:before-fetch-request", "turbo:before-fetch-response"],
          "mutationEvent": null,
          "removalBoundary": null,
          "postMutationEvent": null,
          "barrier": "none",
          "terminalEvent": "turbo:submit-end or native completion",
          "cancelEvents": [],
          "errorEvents": [],
          "requiredOrder": ["before-fetch-request", "before-fetch-response"]
        },
        {
          "id": "turbo.document.canceled",
          "flow": "Canceled Drive visit before mutation",
          "mutation": false,
          "intentEvents": ["turbo:before-visit"],
          "mutationEvent": null,
          "removalBoundary": null,
          "postMutationEvent": null,
          "barrier": "none",
          "terminalEvent": "canceled turbo:before-visit",